{
  "run_id": "a-basic-timed-motion-4620509c-811b-4e95-a346-e2848bdad98a",
  "condition": "A",
  "task_id": "basic-timed-motion",
  "task_prompt": "Create multiple objects and combine move, rotate, and fade motions without conflicting writers.",
  "agent": "codex-cli 0.149.0",
  "model": "gpt-5.6-sol",
  "reasoning_config": "medium",
  "cli_version": "0.1.0",
  "implementation_commit": "e4e69417f701e0944f1ae4aa8db1017efb9828c0",
  "started_at": "2026-08-21T09:09:51.861Z",
  "first_valid_at": "2026-08-21T09:11:01.211Z",
  "ended_at": "2026-08-21T09:11:01.211Z",
  "status": "completed",
  "task_completion": true,
  "first_check_pass": true,
  "repair_iterations": 0,
  "hallucinated_api_calls": 0,
  "invalid_api_values": 0,
  "docs_search_count": 0,
  "direct_docs_calls": 0,
  "check_driven_repair_success": false,
  "final_errors": 0,
  "final_warnings": 3,
  "time_to_valid_project_seconds": 69.35,
  "generated_loc": 76,
  "cli_calls": 0,
  "check_calls": 0,
  "final_source_sha256": "11d4a8af331a7000f65078962dbc1f9062522663a5c2ddce6b42f5cbbaf54276",
  "protocol_deviations": [],
  "notes": [
    "Hallucinated API calls, invalid API values, repair iterations, and check-driven repair success remain unaudited in the raw record.",
    "A/B time-to-valid includes evaluator time after the child agent stopped.",
    "Human audit by ChatGPT (GPT-5.6 Sol) at 2026-08-21T09:34:22.000Z: Reviewed transcript, CLI events, undefined API candidates, final source, and evaluation; no undefined or invalid agent-authored API usage and no check-driven candidate repair. | Human reviewer approved the audit proposal and judgment notes without changes."
  ]
}
