{
  "run_id": "c-depth-crossing-52f35745-9a5b-45c6-96ef-fa734ab84e07",
  "condition": "C",
  "task_id": "depth-crossing",
  "task_prompt": "Move an object from behind another object to the front using EaC depth semantics.",
  "agent": "codex-cli 0.149.0",
  "model": "gpt-5.6-sol",
  "reasoning_config": "medium",
  "cli_version": "0.1.0",
  "implementation_commit": "e4e69417f701e0944f1ae4aa8db1017efb9828c0",
  "started_at": "2026-08-21T09:00:15.772Z",
  "first_valid_at": "2026-08-21T09:01:31.532Z",
  "ended_at": "2026-08-21T09:01:37.329Z",
  "status": "completed",
  "task_completion": true,
  "first_check_pass": true,
  "repair_iterations": 0,
  "hallucinated_api_calls": 0,
  "invalid_api_values": 0,
  "docs_search_count": 1,
  "direct_docs_calls": 3,
  "check_driven_repair_success": false,
  "final_errors": 0,
  "final_warnings": 1,
  "time_to_valid_project_seconds": 75.76,
  "generated_loc": 34,
  "cli_calls": 9,
  "check_calls": 1,
  "final_source_sha256": "14b7d2d49c8f959fb21e2f22dfa499e094c4106df17c83ed5259c9e3a93efd78",
  "protocol_deviations": [],
  "notes": [
    "Hallucinated API calls, invalid API values, repair iterations, and check-driven repair success remain unaudited in the raw record.",
    "A/B time-to-valid includes evaluator time after the child agent stopped.",
    "Human audit by ChatGPT (GPT-5.6 Sol) at 2026-08-21T09:34:22.000Z: Reviewed transcript and the first passing task-complete check with one accepted AABB warning; no later candidate edit/check removed a finding. | Human reviewer approved the audit proposal and judgment notes without changes."
  ]
}
