{
  "run_id": "b-basic-timed-motion-0832d35d-2a2c-4652-ac0d-01277db13d2d",
  "condition": "B",
  "task_id": "basic-timed-motion",
  "task_prompt": "Create multiple objects and combine move, rotate, and fade motions without conflicting writers.",
  "agent": "codex-cli 0.149.0",
  "model": "gpt-5.6-sol",
  "reasoning_config": "medium",
  "cli_version": "0.1.0",
  "implementation_commit": "e4e69417f701e0944f1ae4aa8db1017efb9828c0",
  "started_at": "2026-08-21T09:16:05.931Z",
  "first_valid_at": "2026-08-21T09:17:57.175Z",
  "ended_at": "2026-08-21T09:17:57.175Z",
  "status": "completed",
  "task_completion": true,
  "first_check_pass": false,
  "repair_iterations": 0,
  "hallucinated_api_calls": 0,
  "invalid_api_values": 0,
  "docs_search_count": 1,
  "direct_docs_calls": 5,
  "check_driven_repair_success": false,
  "final_errors": 0,
  "final_warnings": 2,
  "time_to_valid_project_seconds": 111.244,
  "generated_loc": 108,
  "cli_calls": 11,
  "check_calls": 1,
  "final_source_sha256": "466ba3a0cffa01b8488ba99d6ad16de09f0e82814c7ac3af3d2de13c9b6870c2",
  "protocol_deviations": [],
  "notes": [
    "Hallucinated API calls, invalid API values, repair iterations, and check-driven repair success remain unaudited in the raw record.",
    "A/B time-to-valid includes evaluator time after the child agent stopped.",
    "Human audit by ChatGPT (GPT-5.6 Sol) at 2026-08-21T09:34:22.000Z: Reviewed transcript and CLI events; unknown docs topics and unavailable CLI commands were not counted as undefined EaC DSL calls, and no checked repair occurred. | Human reviewer approved the audit proposal and judgment notes without changes."
  ]
}
