{
  "run_id": "b-multi-stage-motion-7d5d419e-bfa3-4cbd-82d3-ad741c2415ee",
  "condition": "B",
  "task_id": "multi-stage-motion",
  "task_prompt": "Create sequential motion intervals that rely on current-state inheritance.",
  "agent": "codex-cli 0.149.0",
  "model": "gpt-5.6-sol",
  "reasoning_config": "medium",
  "cli_version": "0.1.0",
  "implementation_commit": "e4e69417f701e0944f1ae4aa8db1017efb9828c0",
  "started_at": "2026-08-21T09:08:46.189Z",
  "first_valid_at": null,
  "ended_at": "2026-08-21T09:09:51.640Z",
  "status": "completed",
  "task_completion": false,
  "first_check_pass": false,
  "repair_iterations": 0,
  "hallucinated_api_calls": 0,
  "invalid_api_values": 0,
  "docs_search_count": 1,
  "direct_docs_calls": 1,
  "check_driven_repair_success": false,
  "final_errors": 1,
  "final_warnings": 0,
  "time_to_valid_project_seconds": null,
  "generated_loc": 31,
  "cli_calls": 5,
  "check_calls": 1,
  "final_source_sha256": "0f600f9718b0c34b76fb8c8600cd6ea6b2f9484161eb5a4c796e840ba047c8df",
  "protocol_deviations": [],
  "notes": [
    "Hallucinated API calls, invalid API values, repair iterations, and check-driven repair success remain unaudited in the raw record.",
    "A/B time-to-valid includes evaluator time after the child agent stopped.",
    "Human audit by ChatGPT (GPT-5.6 Sol) at 2026-08-21T09:34:22.000Z: Reviewed transcript and evaluator evidence; the final format failure was not an invalid API value, unavailable CLI commands were not DSL hallucinations, and no checked repair occurred. | Human reviewer approved the audit proposal and judgment notes without changes."
  ]
}
