{
  "run_id": "c-cycloid-0f68616a-5550-47c2-8a67-eb7050d14958",
  "condition": "C",
  "task_id": "cycloid",
  "task_prompt": "Move one object along a cycloid trajectory and produce a valid deterministic frame.",
  "agent": "codex-cli 0.149.0",
  "model": "gpt-5.6-sol",
  "reasoning_config": "medium",
  "cli_version": "0.1.0",
  "implementation_commit": "e4e69417f701e0944f1ae4aa8db1017efb9828c0",
  "started_at": "2026-08-21T08:59:04.997Z",
  "first_valid_at": "2026-08-21T09:00:00.668Z",
  "ended_at": "2026-08-21T09:00:15.323Z",
  "status": "completed",
  "task_completion": true,
  "first_check_pass": true,
  "repair_iterations": 0,
  "hallucinated_api_calls": 0,
  "invalid_api_values": 0,
  "docs_search_count": 1,
  "direct_docs_calls": 1,
  "check_driven_repair_success": false,
  "final_errors": 0,
  "final_warnings": 0,
  "time_to_valid_project_seconds": 55.671,
  "generated_loc": 28,
  "cli_calls": 9,
  "check_calls": 1,
  "final_source_sha256": "b93a80d5a38b96bfb0f5201216d006e03c324bf587bb1703996a78f165851505",
  "protocol_deviations": [],
  "notes": [
    "Hallucinated API calls, invalid API values, repair iterations, and check-driven repair success remain unaudited in the raw record.",
    "A/B time-to-valid includes evaluator time after the child agent stopped.",
    "Human audit by ChatGPT (GPT-5.6 Sol) at 2026-08-21T09:34:22.000Z: Reviewed transcript and the first passing task-complete check; the later unavailable render attempt did not edit or re-check a candidate. | Human reviewer approved the audit proposal and judgment notes without changes."
  ]
}
