{
  "run_id": "b-cycloid-429738f5-3e44-4c32-b402-08af444c2b07",
  "condition": "B",
  "task_id": "cycloid",
  "task_prompt": "Move one object along a cycloid trajectory and produce a valid deterministic frame.",
  "agent": "codex-cli 0.149.0",
  "model": "gpt-5.6-sol",
  "reasoning_config": "medium",
  "cli_version": "0.1.0",
  "implementation_commit": "e4e69417f701e0944f1ae4aa8db1017efb9828c0",
  "started_at": "2026-08-21T09:12:48.815Z",
  "first_valid_at": "2026-08-21T09:15:13.148Z",
  "ended_at": "2026-08-21T09:15:13.148Z",
  "status": "completed",
  "task_completion": true,
  "first_check_pass": false,
  "repair_iterations": 0,
  "hallucinated_api_calls": 0,
  "invalid_api_values": 0,
  "docs_search_count": 1,
  "direct_docs_calls": 2,
  "check_driven_repair_success": false,
  "final_errors": 0,
  "final_warnings": 0,
  "time_to_valid_project_seconds": 144.333,
  "generated_loc": 28,
  "cli_calls": 9,
  "check_calls": 1,
  "final_source_sha256": "f8c866cd3537c842f01bcfc62908d430d24960f017d1b5e05cdcba5b47f35f73",
  "protocol_deviations": [],
  "notes": [
    "Hallucinated API calls, invalid API values, repair iterations, and check-driven repair success remain unaudited in the raw record.",
    "A/B time-to-valid includes evaluator time after the child agent stopped.",
    "Human audit by ChatGPT (GPT-5.6 Sol) at 2026-08-21T09:34:22.000Z: Reviewed transcript, CLI events, final source, and candidate scan; unsupported CLI syntax was not an undefined EaC DSL call and no checked repair occurred. | Human reviewer approved the audit proposal and judgment notes without changes."
  ]
}
