{
  "run_id": "c-multi-stage-motion-9a6176f6-d1f2-44a6-a330-2974b09c7452",
  "condition": "C",
  "task_id": "multi-stage-motion",
  "task_prompt": "Create sequential motion intervals that rely on current-state inheritance.",
  "agent": "codex-cli 0.149.0",
  "model": "gpt-5.6-sol",
  "reasoning_config": "medium",
  "cli_version": "0.1.0",
  "implementation_commit": "e4e69417f701e0944f1ae4aa8db1017efb9828c0",
  "started_at": "2026-08-21T09:06:57.343Z",
  "first_valid_at": "2026-08-21T09:08:34.340Z",
  "ended_at": "2026-08-21T09:08:45.763Z",
  "status": "completed",
  "task_completion": true,
  "first_check_pass": false,
  "repair_iterations": 1,
  "hallucinated_api_calls": 0,
  "invalid_api_values": 0,
  "docs_search_count": 1,
  "direct_docs_calls": 1,
  "check_driven_repair_success": true,
  "final_errors": 0,
  "final_warnings": 0,
  "time_to_valid_project_seconds": 96.997,
  "generated_loc": 22,
  "cli_calls": 7,
  "check_calls": 2,
  "final_source_sha256": "b994197abde726c960453a6590ac36ff2bcf6198f295e49afa43a4e5afdad528",
  "protocol_deviations": [],
  "notes": [
    "Hallucinated API calls, invalid API values, repair iterations, and check-driven repair success remain unaudited in the raw record.",
    "A/B time-to-valid includes evaluator time after the child agent stopped.",
    "Human audit by ChatGPT (GPT-5.6 Sol) at 2026-08-21T09:34:22.000Z: The first task-complete candidate failed the format gate; one formatting edit followed by a passing check removed that finding, so repair iterations is 1 and check-driven repair success is true. | Human reviewer approved the audit proposal and judgment notes without changes."
  ]
}
