{
  "run_id": "c-basic-timed-motion-00d14bdd-6f29-4809-ad06-937113ee4ee3",
  "condition": "C",
  "task_id": "basic-timed-motion",
  "task_prompt": "Create multiple objects and combine move, rotate, and fade motions without conflicting writers.",
  "agent": "codex-cli 0.149.0",
  "model": "gpt-5.6-sol",
  "reasoning_config": "medium",
  "cli_version": "0.1.0",
  "implementation_commit": "e4e69417f701e0944f1ae4aa8db1017efb9828c0",
  "started_at": "2026-08-21T09:19:42.698Z",
  "first_valid_at": "2026-08-21T09:20:58.626Z",
  "ended_at": "2026-08-21T09:21:06.150Z",
  "status": "completed",
  "task_completion": true,
  "first_check_pass": true,
  "repair_iterations": 0,
  "hallucinated_api_calls": 0,
  "invalid_api_values": 0,
  "docs_search_count": 1,
  "direct_docs_calls": 3,
  "check_driven_repair_success": false,
  "final_errors": 0,
  "final_warnings": 0,
  "time_to_valid_project_seconds": 75.928,
  "generated_loc": 88,
  "cli_calls": 7,
  "check_calls": 1,
  "final_source_sha256": "00d529fcd1d96745a527cafbaed6f9d0af5e611401c6d8f198c3a021efc44d29",
  "protocol_deviations": [],
  "notes": [
    "Hallucinated API calls, invalid API values, repair iterations, and check-driven repair success remain unaudited in the raw record.",
    "A/B time-to-valid includes evaluator time after the child agent stopped.",
    "Human audit by ChatGPT (GPT-5.6 Sol) at 2026-08-21T09:34:22.000Z: Reviewed transcript, single passing task-complete check, final source, and candidate scan; no undefined or invalid API usage and no later candidate repair. | Human reviewer approved the audit proposal and judgment notes without changes."
  ]
}
