{
  "run_id": "a-cycloid-ceef01b7-2c05-4c1a-9716-9c640dace9d9",
  "condition": "A",
  "task_id": "cycloid",
  "task_prompt": "Move one object along a cycloid trajectory and produce a valid deterministic frame.",
  "agent": "codex-cli 0.149.0",
  "model": "gpt-5.6-sol",
  "reasoning_config": "medium",
  "cli_version": "0.1.0",
  "implementation_commit": "e4e69417f701e0944f1ae4aa8db1017efb9828c0",
  "started_at": "2026-08-21T09:15:13.375Z",
  "first_valid_at": "2026-08-21T09:16:05.502Z",
  "ended_at": "2026-08-21T09:16:05.502Z",
  "status": "completed",
  "task_completion": true,
  "first_check_pass": true,
  "repair_iterations": 0,
  "hallucinated_api_calls": 0,
  "invalid_api_values": 0,
  "docs_search_count": 0,
  "direct_docs_calls": 0,
  "check_driven_repair_success": false,
  "final_errors": 0,
  "final_warnings": 0,
  "time_to_valid_project_seconds": 52.127,
  "generated_loc": 32,
  "cli_calls": 0,
  "check_calls": 0,
  "final_source_sha256": "43b9913148068ff408b7e1b81d2549f8e3b0668396562ceb1cf409d0a3607928",
  "protocol_deviations": [],
  "notes": [
    "Hallucinated API calls, invalid API values, repair iterations, and check-driven repair success remain unaudited in the raw record.",
    "A/B time-to-valid includes evaluator time after the child agent stopped.",
    "Human audit by ChatGPT (GPT-5.6 Sol) at 2026-08-21T09:34:22.000Z: Reviewed transcript, final cycloid source, candidate scan, and evaluator output; no undefined or invalid agent-authored API usage and no checked repair. | Human reviewer approved the audit proposal and judgment notes without changes."
  ]
}
