{
  "run_id": "b-depth-crossing-4a6773a5-cd7e-4e64-8578-3bff4b7a3e7b",
  "condition": "B",
  "task_id": "depth-crossing",
  "task_prompt": "Move an object from behind another object to the front using EaC depth semantics.",
  "agent": "codex-cli 0.149.0",
  "model": "gpt-5.6-sol",
  "reasoning_config": "medium",
  "cli_version": "0.1.0",
  "implementation_commit": "e4e69417f701e0944f1ae4aa8db1017efb9828c0",
  "started_at": "2026-08-21T09:21:06.560Z",
  "first_valid_at": "2026-08-21T09:22:13.298Z",
  "ended_at": "2026-08-21T09:22:13.298Z",
  "status": "completed",
  "task_completion": true,
  "first_check_pass": false,
  "repair_iterations": 0,
  "hallucinated_api_calls": 0,
  "invalid_api_values": 0,
  "docs_search_count": 1,
  "direct_docs_calls": 3,
  "check_driven_repair_success": false,
  "final_errors": 0,
  "final_warnings": 1,
  "time_to_valid_project_seconds": 66.738,
  "generated_loc": 30,
  "cli_calls": 7,
  "check_calls": 1,
  "final_source_sha256": "235fa9dd1d8919f58a765149cc85f2e6a78da0a3404f76e42c0ecef73d7f47ba",
  "protocol_deviations": [],
  "notes": [
    "Hallucinated API calls, invalid API values, repair iterations, and check-driven repair success remain unaudited in the raw record.",
    "A/B time-to-valid includes evaluator time after the child agent stopped.",
    "Human audit by ChatGPT (GPT-5.6 Sol) at 2026-08-21T09:34:22.000Z: Reviewed transcript and CLI events; the unknown docs topic was not an undefined EaC DSL call, the final API values were valid, and no checked repair occurred. | Human reviewer approved the audit proposal and judgment notes without changes."
  ]
}
