{
  "run_id": "a-depth-crossing-6ab43664-72fc-44aa-a421-52a706a3cec8",
  "condition": "A",
  "task_id": "depth-crossing",
  "task_prompt": "Move an object from behind another object to the front using EaC depth semantics.",
  "agent": "codex-cli 0.149.0",
  "model": "gpt-5.6-sol",
  "reasoning_config": "medium",
  "cli_version": "0.1.0",
  "implementation_commit": "e4e69417f701e0944f1ae4aa8db1017efb9828c0",
  "started_at": "2026-08-21T09:05:58.516Z",
  "first_valid_at": "2026-08-21T09:06:56.937Z",
  "ended_at": "2026-08-21T09:06:56.937Z",
  "status": "completed",
  "task_completion": true,
  "first_check_pass": true,
  "repair_iterations": 0,
  "hallucinated_api_calls": 0,
  "invalid_api_values": 0,
  "docs_search_count": 0,
  "direct_docs_calls": 0,
  "check_driven_repair_success": false,
  "final_errors": 0,
  "final_warnings": 1,
  "time_to_valid_project_seconds": 58.421,
  "generated_loc": 34,
  "cli_calls": 0,
  "check_calls": 0,
  "final_source_sha256": "d069904d790ecc414c8c8c823a2bd8adbe44d44c2120dff63cf890a4943454b2",
  "protocol_deviations": [],
  "notes": [
    "Hallucinated API calls, invalid API values, repair iterations, and check-driven repair success remain unaudited in the raw record.",
    "A/B time-to-valid includes evaluator time after the child agent stopped.",
    "Human audit by ChatGPT (GPT-5.6 Sol) at 2026-08-21T09:34:22.000Z: Reviewed transcript, final depth-transition source, candidate scan, and evaluator output; no undefined or invalid agent-authored API usage and no checked repair. | Human reviewer approved the audit proposal and judgment notes without changes."
  ]
}
